{
  "$schema": "https://cdn.jsdelivr.net/gh/Mindful-Connect/happly-ui-npm@production/schemas/registry-item.json",
  "name": "utils",
  "type": "registry:lib",
  "title": "Utils",
  "description": "Utility functions for class name merging.",
  "dependencies": [
    "clsx",
    "tailwind-merge"
  ],
  "registryDependencies": [],
  "files": [
    {
      "path": "lib/utils.ts",
      "type": "registry:lib"
    }
  ]
}
