{
  "$schema": "https://cdn.jsdelivr.net/gh/Mindful-Connect/happly-ui-npm@production/schemas/registry-item.json",
  "name": "card",
  "type": "registry:ui",
  "title": "Card",
  "description": "A card container component.",
  "dependencies": [],
  "registryDependencies": [],
  "files": [
    {
      "path": "ui/card.tsx",
      "type": "registry:ui",
      "content": "import * as React from \"react\";\n\nimport { cn } from \"@/lib/utils\";\n\nconst Card = React.forwardRef<\n  HTMLDivElement,\n  React.HTMLAttributes<HTMLDivElement>\n>(({ className, ...props }, ref) => (\n  <div\n    ref={ref}\n    className={cn(\n      \"rounded-lg border bg-card text-card-foreground shadow-sm\",\n      className\n    )}\n    {...props}\n  />\n));\nCard.displayName = \"Card\";\n\nconst CardHeader = React.forwardRef<\n  HTMLDivElement,\n  React.HTMLAttributes<HTMLDivElement>\n>(({ className, ...props }, ref) => (\n  <div\n    ref={ref}\n    className={cn(\"flex flex-col space-y-1.5 p-6\", className)}\n    {...props}\n  />\n));\nCardHeader.displayName = \"CardHeader\";\n\nconst CardTitle = React.forwardRef<\n  HTMLDivElement,\n  React.HTMLAttributes<HTMLDivElement>\n>(({ className, ...props }, ref) => (\n  <div\n    ref={ref}\n    className={cn(\n      \"text-2xl font-semibold leading-none tracking-tight\",\n      className\n    )}\n    {...props}\n  />\n));\nCardTitle.displayName = \"CardTitle\";\n\nconst CardDescription = React.forwardRef<\n  HTMLDivElement,\n  React.HTMLAttributes<HTMLDivElement>\n>(({ className, ...props }, ref) => (\n  <div\n    ref={ref}\n    className={cn(\"text-sm text-muted-foreground\", className)}\n    {...props}\n  />\n));\nCardDescription.displayName = \"CardDescription\";\n\nconst CardContent = React.forwardRef<\n  HTMLDivElement,\n  React.HTMLAttributes<HTMLDivElement>\n>(({ className, ...props }, ref) => (\n  <div ref={ref} className={cn(\"p-6 pt-0\", className)} {...props} />\n));\nCardContent.displayName = \"CardContent\";\n\nconst CardFooter = React.forwardRef<\n  HTMLDivElement,\n  React.HTMLAttributes<HTMLDivElement>\n>(({ className, ...props }, ref) => (\n  <div\n    ref={ref}\n    className={cn(\"flex items-center p-6 pt-0\", className)}\n    {...props}\n  />\n));\nCardFooter.displayName = \"CardFooter\";\n\nexport { Card, CardHeader, CardFooter, CardTitle, CardDescription, CardContent };\n"
    }
  ]
}
