{
  "$schema": "https://cdn.jsdelivr.net/gh/Mindful-Connect/happly-ui-npm@production/schemas/registry-item.json",
  "name": "custom-input-wrapper",
  "type": "registry:ui",
  "title": "Custom Input Wrapper",
  "description": "A wrapper for custom inputs with consistent styling.",
  "dependencies": [],
  "registryDependencies": ["happly-ui-utils"],
  "files": [
    {
      "path": "ui/custom-input-wrapper.tsx",
      "type": "registry:ui"
    }
  ]
}
