{
  "$schema": "https://cdn.jsdelivr.net/gh/Mindful-Connect/happly-ui-npm@production/schemas/registry-item.json",
  "name": "key-icon",
  "type": "registry:ui",
  "title": "Key Icon",
  "description": "An icon container with various styles and colors.",
  "dependencies": ["class-variance-authority"],
  "registryDependencies": ["utils"],
  "files": [
    {
      "path": "ui/key-icon.tsx",
      "type": "registry:ui"
    }
  ]
}
