{
  "$schema": "https://cdn.jsdelivr.net/gh/Mindful-Connect/happly-ui-npm@production/schemas/registry-item.json",
  "name": "radio-group",
  "type": "registry:ui",
  "title": "Radio Group",
  "description": "A set of checkable buttons\u2014known as radio buttons\u2014where no more than one of the buttons can be checked at a time.",
  "dependencies": ["@radix-ui/react-radio-group"],
  "registryDependencies": ["happly-ui-utils"],
  "files": [
    {
      "path": "ui/radio-group.tsx",
      "type": "registry:ui"
    }
  ]
}
