{
  "$schema": "https://cdn.jsdelivr.net/gh/Mindful-Connect/happly-ui-npm@production/schemas/registry-item.json",
  "name": "use-controllable-field-value",
  "type": "registry:lib",
  "title": "useControllableFieldValue",
  "description": "Hook that resolves a field's value and change handler in one priority order: explicit prop > React Hook Form binding > internal state.",
  "dependencies": ["react-hook-form"],
  "registryDependencies": ["use-form-field-binding"],
  "files": [
    {
      "path": "lib/use-controllable-field-value.ts",
      "type": "registry:lib"
    }
  ]
}
