{
  "$schema": "https://cdn.jsdelivr.net/gh/Mindful-Connect/happly-ui-npm@production/schemas/registry-item.json",
  "name": "popover",
  "type": "registry:ui",
  "title": "Popover",
  "description": "Displays rich content in a portal, triggered by a button.",
  "dependencies": [
    "@radix-ui/react-popover"
  ],
  "registryDependencies": [
    "happly-ui-utils"
  ],
  "files": [
    {
      "path": "ui/popover.tsx",
      "type": "registry:ui"
    }
  ]
}
