{
  "$schema": "https://cdn.jsdelivr.net/gh/Mindful-Connect/happly-ui-npm@production/schemas/registry-item.json",
  "name": "dialog",
  "type": "registry:ui",
  "title": "Dialog",
  "description": "A window overlaid on either the primary window or another dialog window.",
  "dependencies": [
    "@radix-ui/react-dialog",
    "react-icons"
  ],
  "registryDependencies": [
    "utils"
  ],
  "files": [
    {
      "path": "ui/dialog.tsx",
      "type": "registry:ui"
    }
  ]
}
