{
  "$schema": "https://cdn.jsdelivr.net/gh/Mindful-Connect/happly-ui-npm@production/schemas/registry-item.json",
  "name": "command",
  "type": "registry:ui",
  "title": "Command",
  "description": "Fast, composable, unstyled command menu for React.",
  "dependencies": [
    "cmdk",
    "@radix-ui/react-dialog",
    "@radix-ui/react-scroll-area",
    "react-icons"
  ],
  "registryDependencies": ["dialog", "happly-ui-utils"],
  "files": [
    {
      "path": "ui/command.tsx",
      "type": "registry:ui"
    }
  ]
}
