{
  "$schema": "https://cdn.jsdelivr.net/gh/Mindful-Connect/happly-ui-npm@production/schemas/registry-item.json",
  "name": "command",
  "type": "registry:ui",
  "title": "Command",
  "description": "Fast, composable, unstyled command menu for React.",
  "dependencies": [
    "cmdk",
    "@radix-ui/react-dialog",
    "@radix-ui/react-scroll-area",
    "react-icons"
  ],
  "registryDependencies": [
    "utils",
    "dialog"
  ],
  "files": [
    {
      "path": "ui/command.tsx",
      "type": "registry:ui",
      "content": "'use client';\n\nimport * as React from 'react';\nimport { type DialogProps } from '@radix-ui/react-dialog';\nimport { Command as CommandPrimitive } from 'cmdk';\nimport * as ScrollAreaPrimitives from '@radix-ui/react-scroll-area';\nimport { RiSearchLine } from 'react-icons/ri';\n\nimport { cn } from '@/lib/utils';\nimport { Dialog, DialogContent } from '@/components/ui/dialog';\n\nconst Command = React.forwardRef<\n  React.ElementRef<typeof CommandPrimitive>,\n  React.ComponentPropsWithoutRef<typeof CommandPrimitive>\n>(({ className, ...props }, ref) => (\n  <CommandPrimitive\n    ref={ref}\n    className={cn(\n      'flex h-full w-full flex-col overflow-hidden rounded-2xl bg-popover text-popover-foreground',\n      className\n    )}\n    {...props}\n  />\n));\nCommand.displayName = CommandPrimitive.displayName;\n\nconst CommandDialog = ({ children, ...props }: DialogProps) => {\n  return (\n    <Dialog {...props}>\n      <DialogContent className='overflow-hidden p-0'>\n        <Command className='[&_[cmdk-group-heading]]:px-2 [&_[cmdk-group-heading]]:font-medium [&_[cmdk-group-heading]]:text-muted-foreground [&_[cmdk-group]:not([hidden])_~[cmdk-group]]:pt-0 [&_[cmdk-group]]:px-2 [&_[cmdk-input-wrapper]_svg]:h-5 [&_[cmdk-input-wrapper]_svg]:w-5 [&_[cmdk-input]]:h-12 [&_[cmdk-item]]:px-2 [&_[cmdk-item]]:py-3 [&_[cmdk-item]_svg]:h-5 [&_[cmdk-item]_svg]:w-5'>\n          {children}\n        </Command>\n      </DialogContent>\n    </Dialog>\n  );\n};\n\nconst CommandInput = React.forwardRef<\n  React.ElementRef<typeof CommandPrimitive.Input>,\n  React.ComponentPropsWithoutRef<typeof CommandPrimitive.Input>\n>(({ className, ...props }, ref) => (\n  <div className='flex items-center border-b px-3' cmdk-input-wrapper=''>\n    <RiSearchLine className='mr-2 h-4 w-4 shrink-0 opacity-50' />\n    <CommandPrimitive.Input\n      ref={ref}\n      className={cn(\n        'flex h-10 w-full rounded-lg bg-transparent py-3 text-sm placeholder:text-muted-foreground disabled:cursor-not-allowed disabled:opacity-50',\n        'shadow-none focus:border-none focus:outline-none focus:ring-0',\n        '!border-none !outline-none',\n        className\n      )}\n      {...props}\n    />\n  </div>\n));\n\nCommandInput.displayName = CommandPrimitive.Input.displayName;\n\nconst CommandList = React.forwardRef<\n  React.ElementRef<typeof CommandPrimitive.List>,\n  React.ComponentPropsWithoutRef<typeof CommandPrimitive.List>\n>(({ className, ...props }, ref) => (\n  <ScrollAreaPrimitives.Root type='auto' className='w-full'>\n    <ScrollAreaPrimitives.Viewport\n      className={cn(\n        'max-h-[300px] w-full scroll-py-2', // Padding if needed\n        'overflow-x-hidden' // Prevent x-scrollbars\n      )}\n    >\n      <CommandPrimitive.List\n        ref={ref}\n        className={cn('w-full', className)} // Inner list doesn't control overflow\n        {...props}\n      />\n    </ScrollAreaPrimitives.Viewport>\n    <ScrollAreaPrimitives.Scrollbar orientation='vertical' className='w-1'>\n      <ScrollAreaPrimitives.Thumb className='rounded bg-ds-soft-200' />\n    </ScrollAreaPrimitives.Scrollbar>\n  </ScrollAreaPrimitives.Root>\n));\n\nCommandList.displayName = CommandPrimitive.List.displayName;\n\nconst CommandEmpty = React.forwardRef<\n  React.ElementRef<typeof CommandPrimitive.Empty>,\n  React.ComponentPropsWithoutRef<typeof CommandPrimitive.Empty>\n>((props, ref) => (\n  <CommandPrimitive.Empty\n    ref={ref}\n    className='py-6 text-center text-sm'\n    {...props}\n  />\n));\n\nCommandEmpty.displayName = CommandPrimitive.Empty.displayName;\n\nconst CommandGroup = React.forwardRef<\n  React.ElementRef<typeof CommandPrimitive.Group>,\n  React.ComponentPropsWithoutRef<typeof CommandPrimitive.Group>\n>(({ className, ...props }, ref) => (\n  <CommandPrimitive.Group\n    ref={ref}\n    className={cn(\n      'overflow-hidden p-1 text-foreground [&_[cmdk-group-heading]]:px-2 [&_[cmdk-group-heading]]:py-1.5 [&_[cmdk-group-heading]]:text-xs [&_[cmdk-group-heading]]:font-medium [&_[cmdk-group-heading]]:text-muted-foreground',\n      className\n    )}\n    {...props}\n  />\n));\n\nCommandGroup.displayName = CommandPrimitive.Group.displayName;\n\nconst CommandSeparator = React.forwardRef<\n  React.ElementRef<typeof CommandPrimitive.Separator>,\n  React.ComponentPropsWithoutRef<typeof CommandPrimitive.Separator>\n>(({ className, ...props }, ref) => (\n  <CommandPrimitive.Separator\n    ref={ref}\n    className={cn('-mx-1 h-px bg-border', className)}\n    {...props}\n  />\n));\nCommandSeparator.displayName = CommandPrimitive.Separator.displayName;\n\nconst CommandItem = React.forwardRef<\n  React.ElementRef<typeof CommandPrimitive.Item>,\n  React.ComponentPropsWithoutRef<typeof CommandPrimitive.Item>\n>(({ className, ...props }, ref) => (\n  <CommandPrimitive.Item\n    ref={ref}\n    className={cn(\n      'relative flex cursor-default select-none items-center gap-2 rounded-lg px-2 py-1.5 text-sm outline-none data-[disabled=true]:pointer-events-none data-[selected=true]:bg-accent data-[disabled=true]:text-ds-disabled-300 data-[selected=true]:text-accent-foreground [&_svg]:pointer-events-none [&_svg]:size-4 [&_svg]:shrink-0',\n      className\n    )}\n    {...props}\n  />\n));\n\nCommandItem.displayName = CommandPrimitive.Item.displayName;\n\nconst CommandShortcut = ({\n  className,\n  ...props\n}: React.HTMLAttributes<HTMLSpanElement>) => {\n  return (\n    <span\n      className={cn(\n        'ml-auto text-xs tracking-widest text-muted-foreground',\n        className\n      )}\n      {...props}\n    />\n  );\n};\nCommandShortcut.displayName = 'CommandShortcut';\n\nexport {\n  Command,\n  CommandDialog,\n  CommandInput,\n  CommandList,\n  CommandEmpty,\n  CommandGroup,\n  CommandItem,\n  CommandShortcut,\n  CommandSeparator,\n};\n"
    }
  ]
}
