{
  "$schema": "https://cdn.jsdelivr.net/gh/Mindful-Connect/happly-ui-npm@production/schemas/registry-item.json",
  "name": "alert-utils",
  "type": "registry:lib",
  "title": "Alert Utils",
  "description": "Utility functions and types for the Alert component.",
  "dependencies": [],
  "registryDependencies": [],
  "files": [
    {
      "path": "lib/alert-utils.ts",
      "type": "registry:lib"
    }
  ]
}
