{
  "$schema": "https://cdn.jsdelivr.net/gh/Mindful-Connect/happly-ui-npm@production/schemas/registry-item.json",
  "name": "polymorphic",
  "type": "registry:lib",
  "title": "Polymorphic",
  "description": "Polymorphic component type helper for the 'as' prop pattern.",
  "dependencies": [],
  "registryDependencies": [],
  "files": [
    {
      "path": "lib/polymorphic.ts",
      "type": "registry:lib"
    }
  ]
}
