{
  "$schema": "https://cdn.jsdelivr.net/gh/Mindful-Connect/happly-ui-npm@production/schemas/registry-item.json",
  "name": "use-form-field-binding",
  "type": "registry:lib",
  "title": "useFormFieldBinding",
  "description": "Hook that auto-binds happly-ui components to React Hook Form via FormFieldContext. Eliminates manual watch/setValue wiring; pass null or { bind: false } to opt a secondary control out of binding.",
  "dependencies": ["react-hook-form"],
  "registryDependencies": ["form-field-context"],
  "files": [
    {
      "path": "lib/use-form-field-binding.ts",
      "type": "registry:lib"
    }
  ]
}
