{
  "$schema": "https://cdn.jsdelivr.net/gh/Mindful-Connect/happly-ui-npm@production/schemas/registry-item.json",
  "name": "tv",
  "type": "registry:lib",
  "title": "Tailwind Variants",
  "description": "Tailwind Variants wrapper with cn() for class merging.",
  "dependencies": [
    "tailwind-variants"
  ],
  "registryDependencies": [
    "utils"
  ],
  "files": [
    {
      "path": "lib/tv.ts",
      "type": "registry:lib"
    }
  ]
}
