{
  "$schema": "https://cdn.jsdelivr.net/gh/Mindful-Connect/happly-ui-npm@production/schemas/registry-item.json",
  "name": "recursive-clone-children",
  "type": "registry:lib",
  "title": "Recursive Clone Children",
  "description": "Utility to recursively clone React children and inject shared props.",
  "dependencies": [],
  "registryDependencies": [],
  "files": [
    {
      "path": "utils/recursive-clone-children.ts",
      "type": "registry:lib",
      "content": "import * as React from \"react\";\n\n/**\n * Recursively clones React children and injects shared props\n * into components whose displayName matches the allowed list\n *\n * @param children - React children to clone\n * @param sharedProps - Props to inject into matching children\n * @param allowedDisplayNames - Array of displayNames that should receive the shared props\n * @param uniqueId - Unique identifier for generating stable keys\n * @param asChild - If true, skips the first level (for Slot components)\n */\nexport function recursiveCloneChildren(\n  children: React.ReactElement | React.ReactElement[],\n  sharedProps: Record<string, unknown>,\n  allowedDisplayNames: string[],\n  uniqueId: string,\n  asChild?: boolean\n): React.ReactNode {\n  return React.Children.map(children, (child, index) => {\n    if (!React.isValidElement(child)) {\n      return child;\n    }\n\n    const childType = child.type as React.ComponentType & {\n      displayName?: string;\n    };\n    const displayName = childType?.displayName;\n\n    // Check if this child should receive shared props\n    const shouldInjectProps =\n      displayName && allowedDisplayNames.includes(displayName);\n\n    // Recursively handle nested children\n    const childChildren = (child.props as { children?: React.ReactNode })\n      .children;\n    const clonedChildren = childChildren\n      ? recursiveCloneChildren(\n          childChildren as React.ReactElement[],\n          sharedProps,\n          allowedDisplayNames,\n          uniqueId,\n          false\n        )\n      : undefined;\n\n    // If asChild is true and this is the first level, just clone with children\n    if (asChild && index === 0) {\n      return React.cloneElement(child, {\n        key: `${uniqueId}-${index}`,\n        children: clonedChildren,\n      } as Partial<unknown>);\n    }\n\n    // Clone with shared props if displayName matches\n    if (shouldInjectProps) {\n      return React.cloneElement(child, {\n        key: `${uniqueId}-${index}`,\n        ...sharedProps,\n        ...(child.props as object),\n        children: clonedChildren,\n      } as Partial<unknown>);\n    }\n\n    // Just clone with updated children\n    return React.cloneElement(child, {\n      key: `${uniqueId}-${index}`,\n      children: clonedChildren,\n    } as Partial<unknown>);\n  });\n}\n"
    }
  ]
}
